{
  "version": "1.0",
  "meta": {
    "tempo_bpm": 240,
    "key": "A",
    "genre": "electronic",
    "mood": "energetic",
    "time_signature": "4/4",
    "bars": 4
  },
  "chords": [
    {
      "symbol": "I",
      "start_bar": 1,
      "duration_beats": 4
    },
    {
      "symbol": "IV",
      "start_bar": 2,
      "duration_beats": 4
    },
    {
      "symbol": "V",
      "start_bar": 3,
      "duration_beats": 4
    },
    {
      "symbol": "I",
      "start_bar": 4,
      "duration_beats": 4
    }
  ],
  "drums": [
    {
      "instrument": "kick",
      "start_beat": 0,
      "velocity": 90
    },
    {
      "instrument": "snare",
      "start_beat": 2,
      "velocity": 80
    },
    {
      "instrument": "hihat_closed",
      "start_beat": 1,
      "velocity": 60
    },
    {
      "instrument": "hihat_closed",
      "start_beat": 3,
      "velocity": 60
    }
  ],
  "melody": [
    {
      "pitch": 69,
      "start_beat": 0,
      "duration_beats": 1,
      "velocity": 80
    },
    {
      "pitch": 67,
      "start_beat": 1,
      "duration_beats": 1,
      "velocity": 75
    },
    {
      "pitch": 65,
      "start_beat": 2,
      "duration_beats": 1,
      "velocity": 70
    },
    {
      "pitch": 64,
      "start_beat": 3,
      "duration_beats": 1,
      "velocity": 72
    }
  ]
}
