{"version":"1.0","meta":{"tempo_bpm":80,"key":"Am","genre":"lo-fi","mood":"melancholic","time_signature":"4/4","bars":2},"chords":[{"symbol":"i","start_bar":1,"duration_beats":4}],"drums":[{"instrument":"kick","start_beat":0,"velocity":90}],"melody":[{"pitch":69,"start_beat":10,"duration_beats":1,"velocity":80},{"pitch":67,"start_beat":11,"duration_beats":1,"velocity":75},{"pitch":65,"start_beat":12,"duration_beats":1,"velocity":70},{"pitch":64,"start_beat":13,"duration_beats":1,"velocity":72}]}